title,time,url,content
电子信息产业主营业务年收入近300亿元！德州打造高质量发展“芯”动力,2024-04-16 15:01,http://www.sohu.com/a/772066500_121944246,"原标题：电子信息产业主营业务年收入近300亿元！德州打造高质量发展“芯”动力
2023中国半导体材料产业发展（德州）峰会10月16日在山东省德州市开幕。峰会特邀国内半导体材料领域院士专家、重点企业主要负责人等业界精英代表参加，共商半导体材料技术、产业发展的最优路径，为德州经济高质量发展注入不竭“芯”动力。
自2013年引进外资芯片封装企业威讯联合半导体公司开始，德州市利用10年时间，推动电子信息产业实现了从无到有、多点开花的蝶变。目前德州拥有电子信息规上企业123家，去年实现主营业务收入近300亿元。
抢赛道，敲开产业发展大门
“集成电路是信息技术产业高速发展的基础，涉及国民经济和社会发展的各个领域，是引领新一轮科技革命和产业革命的关键力量。”德州市工信局局长孙洪昌表示，德州市集成电路产业起步不算早，但特色鲜明，发展势头迅猛。
威讯是德州集成电路产业引进的首个“大块头”。企业以生产手机芯片为主营业务，客户覆盖苹果、三星、华为等知名手机品牌。威讯联合半导体（德州）有限公司总经理段树刚介绍，2002年美国威讯公司进入中国市场，在北京设立第一个分厂。2013年随着市场不断增长，北京分厂的承载能力达到极限，公司决定建设第二家分厂，德州凭借交通区位优势进入最终选择地点论证范围。
2016年7月14日，威讯联合半导体（德州）有限公司正式运营，从企业选址到成品下线仅用了不到20个月的时间。段树刚真切感受到德州优越的营商环境和大力发展集成电路产业的信心决心。“公司对空运进出口的时效要求极高，在2017年因为企业出口量提升过快，相对通关速度不适应。对此，德州市商务局、德州经济技术开发区协同德州海关特事特办，为企业办理了AEO高级认证。通关效率大幅提高，企业成本实现了大幅下降，进出口得以快速增长。”段树刚说。
德州敲开了集成电路产业发展的大门，相关企业陆续落户。2018年，德州鲲程电子科技有限公司注册成立，企业致力做强民爆电子雷管领域“中国芯”，核心产品包括民爆物品安全监管平台、数码电子雷管专用芯片等；2020年英望科技落户德州，当年9月即实现量产，2021年公司将总部从深圳迁至德州，成为德州市引入的首家具备一定规模的集成电路下游消费电子制造企业；2022年德州芯邑半导体有限公司注册成立，填补了临邑县半导体产业的空白，该公司迅速引入了芯邑半导体封测、友元智能早教机器人、金乐信智能终端产业链等7个“链式”项目进驻，为当地半导体产业建链延链打下基础。
引龙头，持续壮大发展规模
10月16日上午，12英寸集成电路用大硅片产业化项目通线量产仪式在山东有研艾斯半导体材料有限公司举行。“项目总投资62亿元，主要从事12英寸集成电路用大硅片产业化的生产、全部达产后将形成年产360万片大硅片的生产规模。”公司总经理闫志瑞说。
与有研集团的合作，被视为德州集成电路产业发展进入快车道的重要标志。作为国内半导体行业的龙头企业，有研的业务集中于集成电路关键材料领域，从北京外迁后，德州市承接了其最核心的业务，投资规模大、技术水平高。
2018年，德州市与有研科技集团半导体材料公司签约，合作建设集成电路用大尺寸硅材料规模化生产基地项目。项目作为2019年省级重点项目，自签约到建成仅用18个月，产品广泛应用于集成电路、功率器件、太阳能等领域，有效解决我国集成电路关键配套材料“卡脖子”难题。
一期项目落地生根，二期项目如约而至。2019年，德州市政府与有研科技集团、德州汇达基金等签订投资协议，注册成立山东有研艾斯半导体材料有限公司，启动12英寸硅片项目。
2021年，山东有研国晶辉新材料有限公司在乐陵市建成投产。今年9月，与之形成配套关系的有研亿金年产4万块集成电路用高纯溅射靶材生产项目投产，主要用于生产高端集成电路芯片用同系列靶材，市场占有率居世界前三位，德州市也将成为华北地区最大的集成电路用高纯溅射靶材生产基地。
在龙头企业的带动下，德州市抢抓半导体产业发展“窗口期”，持续壮大产业发展规模。据统计，德州现有电子信息规上企业123家，去年实现主营收入近300亿元，拥有国家专精特新“小巨人”企业3家，省级专精特新中小企业32家，省创新型中小企业22家。其中，半导体规上企业10家，实现营收70亿元。近五年来，半导体产业产值年均增长近20%。
优环境，厚植产业成长沃土
产业发展离不开政策支持。德州市把电子信息产业作为全市重点培育的“一号产业链”，由市委主要负责同志任产业链“链长”，强化要素保障，顶格统筹推进，给予重点培植扶持。
坚持规划引领，编制《德州市新一代信息技术产业“十四五”专项发展规划》《德州市“十四五”数字经济专项规划》，坚持现有企业培育壮大和招大引强并举，促进产业数字化与数字产业化发展，着力做好建链、补链、延链、强链文章。
加大政策支持，出台《关于加快集成电路产业发展的实施意见》《德州市先进制造业强市建设若干意见》等专项政策，在创新发展、研发应用、项目建设、设备、信贷以及生产要素等方面给予重点倾斜，鼓励企业智慧赋能。
强化服务保障，成立德州汇达半导体股权投资基金，解决有关项目融资需求问题。实行首席政府服务官企业服务机制，着力解决项目所需电力、污水处理、热力供应等基础设施配套问题。
以天衢新区为例，作为德州发展半导体产业的主阵地，他们建立了产业办实体化运作，成立项目专项基金，为产业壮大提供“保姆式”服务。
鲲程电子落户后，主打产品的销量5年增长了12倍。谈及企业迅速发展的秘诀，董事长庞新直言，与新区的服务密不可分。“2018年，鲲程落户中元科创园。5年间园区累计投资800余万元建立了集成电路模块测试公共服务平台，让企业足不出户完成产品检测及贴片流程，节约了30%的检测成本。”庞新说。
“目前，全区已拥有新一代信息技术（集成电路）相关企业35家，招引培育了较为完善的半导体产业生态。”天衢新区管委会主任王大山说，同时，他们坚持延链补链招引方向，引进第三代半导体封装用散热材料、半导体封装测试实训基地等一批优质项目，并配备产业基金参与集成电路产业项目的投资。
值得一提的是，即将到来的峰会将吸引中国电子材料行业协会、中国有色金属工业协会稀散金属分会等17家行业协会，中国电子科技集团、中科半导体材料有限公司、上海新昇半导体等72家半导体行业头部企业，以及来自京津冀、江浙沪等地的48家半导体行业企业参加，这将为德州市提供与行业制造企业深化沟通联系，强化产业项目招引的优质平台。对此，市委副书记、市长朱开国在新闻发布会上表示：“我们将加强政策支持，强化要素保障，培育壮大半导体材料产业‘领头雁’和‘集团军’。持续完善全要素、一揽子的政策供给体系，尽洒‘阳光雨露’，滋养产业生态，让大项目好项目纷至沓来、产业链生态圈加速成型，让产业发展活力彰显，百花争艳。”返回搜狐，查看更多
责任编辑："
技术创新助力穿越行业周期 海目星2023年营收增至48.05亿元,2024-04-16 14:57,http://www.sohu.com/a/772065688_135869,"原标题：技术创新助力穿越行业周期 海目星2023年营收增至48.05亿元
激光智造产业作为新质生产力的杰出代表，正源源不断地涌现出推动发展的崭新动能，展现出蓬勃生机与活力。海目星（688559.SH）作为激光装备技术创新型企业，也凭借卓越的技术实力和敏锐的市场洞察力，持续引领细分赛道的技术革新与产品创新，不仅深耕光伏、锂电、消费电子、医疗、新型显示等多个应用场景，更在产业战略布局的指引下，展现出强大的穿越周期能力，持续确保业务的稳健发展。
近日，海目星披露了2023年年度报告。报告期内，公司强化创新驱动，经营稳中有进，实现营业收入48.05亿元，同比增长 17.03%；实现归母净利润3.22亿元。同时非常值得一提的是，在2023年整体行业并不乐观的环境下，全年公司新签订单约48亿元（含税），2024年一季度进一步新签订单约8.5亿元（含税），在手订单累计约71亿元（含税）。
创新引领 先进新品不断涌现
海目星始终专注于尖端激光技术及优势产品的研发，以创新为动力，不断提升市场竞争力，积极塑造品牌影响力，为公司的持续发展奠定坚实基础。凭借核心技术优势，公司精准把握市场需求，提供包括激光器在内的核心部件以及完整的激光智能自动化生产线等一站式解决方案，更能根据客户的特定需求，量身定制符合其核心诉求的专用设备。
在报告期内，海目星在动力电池激光及自动化设备领域取得了显著成果，成功推出了微凹双面同步涂膜机、双层宽幅高速涂布机、高速模切机、高速激光清洗机、高速激光划线/打孔机以及固态电池生产相关设备等具备行业竞争力的产品，进一步巩固了市场地位。
同时，在光伏、3C、医疗激光等行业，公司积极开拓市场，不断推出创新产品。在TOPCon新兴技术路线上，公司推出了TBC、双面POLY图形化技术相关设备，展现了强大的技术实力。此外，公司在钙钛矿电池新一代激光技术设备、微晶玻璃激光开料设备、金属料带激光切焊一体机以及高功率长波可调谐飞秒激光器等新设备的研发上也已蓄势待发，展现出十足的发展潜力。
一直以来，海目星公司对于新产品的研发和新兴领域的布局表现出极高的重视。为了持续推动创新，公司不仅加大了研发投入，还积极引进了一批优秀的研发技术人才，并对研发体系进行了深度优化。据最新报告显示，2023年，公司的研发投入达到了5.43亿元，同比大增了30.84%，占营业收入的比例也显著提升至11.31%。
通过多年的研发努力与积累，海目星公司成功掌握了一系列与激光光学及自动化相关的核心技术。截至今年一季度末，公司已拥有专利技术及软件著作权共计1175项，涵盖了106项发明专利、733项实用新型专利、22项外观设计专利以及314项软件著作权，充分展现了公司在技术创新领域的深厚底蕴和强大实力。
光伏、锂电等主业持续稳固
2023年国内激光设备市场销售收入达到910亿元，同比增长5.6%，随着现代制造业，从“制造”逐步迈向“智造”新阶段，这将给包括海目星在内的激光设备同行创造更大的市场空间。
海目星通过深度把握客户需求，已成功开发高速激光划线/打孔机用于3C软包、动力叠片/圆柱，在厚涂布电池极片进行涂覆层表面微结构构建，提升电池循环寿命，计划2024年下半年市场化。针对圆柱电池工艺推出46系直线式装配线和高速转塔装配线，其中高速转塔装配已获得头部客户认可，有望在2024年下半年实现放量。
报告期内，公司参与了固态电池设备的开发，对关键技术和关键工艺取得了进展性突破，并实现了国内固态及准固态电池中试产线的多种设备和产线的交付及生产，其中有部分设备已经实现了480WH/KG的电池量产及销售。
值得关注的是，2023年公司光伏激光设备业务订单实现百倍的增长，市场占有率迅速提升，成为光伏激光设备的双寡头之一。公司通过行业首创Topcon激光SE一次掺杂设备成功切入光伏行业，并且公司在多项光伏电池激光新技术和新产品上实现突破。目前激光烧结（LAS）设备已实现批量出货；BC电池激光开模设备，实现高效、高精度和低损伤加工的工艺突破，已在部分客户端进行批量验证；Topcon电池双面POLY图形化技术关键技术已实现突破性进展，该项技术的量产将助力公司在光伏领域产品实现接力式增长。
此外，公司3C业务整体上推行稳健的经营策略，聚焦在利润率较高、可持续性更好的产品线上，实现了经营结果的显著改善。同时，公司持续创新，推出微晶玻璃激光开料设备、SMA高速挂线机等多款行业首创设备，为客户创造价值。 在新型显示业务中，海目星结合行业趋势与客户需求，进一步聚焦 Mini/Micro Led高端核心关键设备研发，推出巨量转移、巨量焊接及激光返修设备。
大力拓展海外业务、重塑增长潜力
智能制造产业作为战略性、基础性产业，既是未来高新技术产业发展的基石，也是加速新质生产力发展的重要动能之一。近年来，我国智能制造产业规模不断扩大，产业创新能力持续提升。作为激光智能化设备的领跑者，海目星先后开发了应用于消费电子、动力及储能电池、光伏电池及新型显示和钣金加工等重要领域的激光及自动化设备。同时，公司还在积极拓展医疗激光等新兴业务板块，以巩固并增强公司的行业领先地位及核心竞争力。
在主业基本盘稳固的同时，公司主动把握海外发展机遇，积极进行海外市场开拓。根据公开资料显示，锂电池企业出海已经展现出积极势头，锂电池出口额650.07亿美元创下新纪录。随着全球新能源政策及汽车电动化趋势的持续推进，海外新能源汽车渗透率未来还有较大的成长空间。
面对锂电出海的巨大机遇，海目星在深耕国内细分销售市场的同时，积极开拓海外市场。凭借卓越的产品技术实力、丰富的海外交付经验、完善的海外供应链布局以及优质的售后服务，海目星赢得了海外客户的一致好评。而且公司采取与国内优秀企业合作、携手日韩系电池企业以及为海外客户提供一体化设备解决方案的“三步走”策略，稳扎稳打地推进海外市场拓展。同时，公司还加速了在海外市场的战略布局，截至2024年3月31日，公司已在欧洲、北美、亚洲等多个地区设立了8家海外子公司，海外战略已显露出显著成效，赢得了越来越多美国和欧洲头部客户的青睐。
进入千亿蓝海市场、长期投资价值凸显
得益于激光技术优异的特性，激光医疗具有应用范围广、精确度高、见效快、安全可靠、副作用小等特点，且由于精准安全的特性，激光医疗已成为一种不可替代且疗效显著的治疗手段，并逐渐发展为现代医学的重要分支。
激光在医疗领域的应用非常广泛，主要应用场景可分为激光诊断、激光治疗、激光美容、激光检测等。根据新氧研究院和Frost&Sullivan数据，预计2030年非手术类医美市场规模可达4,157亿元，按照2022年光电类占非手术类项目比例为53.30%测算，预计2030年光电医美消费市场规模可超2,000亿元。
在医疗激光领域，海目星当前已自主研发成功一款新型高功率长波长可调谐中红外飞秒激光器产品，与国际国内现有产品相比，该产品采用光参量放大技术结合宽带隙高性能的非线性晶体，在全球范围内首次实现了瓦量级平均功率及5-11μm自由调谐长波长中红外飞秒脉冲输出，将近红外到中红外飞秒激光的转换效率提升了一个数量级。
公开资料显示，飞秒激光相较其他激光,具有精确的靶向聚焦定位特点，能够聚焦到比头发的直径还要小的多的超细微空间区域，而且由于没有热效应和冲击波，在整个光程中都不会有组织损伤。高精度、能量强、低附加损伤让飞秒激光在超精细材料加工领域优势凸显。而海目星研发成功的中红外飞秒激光，为新型微创医疗的研究和应用提供了新的工具，其医疗适用范围和应用前景主要为：胶原再生类年轻化医美应用、皮肤剥脱式和非剥脱式微创治疗、角膜微创切割和移植、动脉粥样硬化微创消融、胰腺肿瘤选择性消融等。
由此可见，公司不仅在工业激光领域竞争优势凸显，未来更有希望在医疗激光、半导体等高精尖领域实现市场突破，进一步折射出公司优异的投资价值。
多措并举持续优化管理模式
新质生产力最重要的核心标志是全要素生产率的大幅提升，这其中技术水平、管理能力等作用至关重要。
海目星站在尖端激光技术及优势产品研发的前沿，以持续创新为引擎，不断提升公司的市场核心竞争力。凭借领先的技术实力和有效的市场开拓能力，公司持续引领所处细分赛道的技术升级和产品创新，现已成为横跨生命医学、新能源、新型显示以及消费电子等多个高新产业的激光及自动化智能制造整体解决方案服务商和制造商。
发展过程中，海目星积极引进优秀管理理念，围绕市场需求集成性研究开发，构建全流程的过程管控，实现制造体系的成本变革、采购体系变革，以及保证供应链稳定，这是保证公司快速进入新的行业并且能够拥有优质的客户和相对较高的订单的底层逻辑。后续公司将不断提升精细化管理水平以及数字化管理能力，为公司在激光技术的多元应用场景的管理质量和管理效率赋能，从而有效推进降本增效与提质增效的并重管理。
“双碳”发展愿景下动力电池、光伏等工业激光市场空间广阔，工业领域大规模设备政策有望助力公司产品需求再度爆发。当前，公司激光自动化平台优势显著，光伏激光设备等业务开启第二成长极，激光医疗千亿市场再度凸显公司长期投资价值，未来海目星将继续向最前沿的激光技术发起冲击，为实现科技自强自立，让中国智造享誉全球的梦想尽绵薄之力。
免责声明：本文仅供参考，不构成投资建议。
广告返回搜狐，查看更多
责任编辑："
盘和林：数字化转型和数实融合，为消费和工业产值增长提供了强有力的支持,2024-04-16 14:57,http://www.sohu.com/a/772066204_120952561,"原标题：盘和林：数字化转型和数实融合，为消费和工业产值增长提供了强有力的支持
封面新闻记者 易弋力
4月16日，国务院新闻办公室举行新闻发布会，国家统计局副局长盛来运介绍2024年一季度国民经济运行情况。
经初步核算，一季度国内生产总值（GDP）296299亿元，按不变价格计算，同比增长5.3%，比上年四季度环比增长1.6%。统计数据显示，农业生产形势良好，工业生产较快增长，服务业增势较好。一季度，农业（种植业）增加值同比增长3.8%，全国规模以上工业增加值同比增长6.1%，服务业增加值同比增长5.0%。
工信部信息通信经济专家委员会委员盘和林
工信部信息通信经济专家委员会委员盘和林分析表示，从整体看，一季度表现良好，给了2024年一个好的开局，按不变价格计算，同比增长5.3%，略高于2024年GDP总目标。从工业数据看，全国规模以上工业增加值同比增长6.1%，工业保持较高的活跃度和增长率，分产品看，充电桩、3D打印设备、电子元件产品产量增速较快，制造业产业结构正在发生好的变化，附加值更高的产业增速更为明显。从数字经济角度看，信息传输、软件和信息技术服务业增长12.7%，在一季度服务业中表现较为亮眼，而这个产业的增速主要来自于企业数字化转型，说明一季度数实融合依然在稳步推进，数字经济，尤其是数字化转型和数实融合是当前服务业增长的重要驱动力，也为消费和工业产值增长提供了强有力的支持。返回搜狐，查看更多
责任编辑："
