title,time,url,content
深圳水贝上演“黄金大劫案”？涉及资金2亿元？记者实探！商家回应,2024-04-16 15:19,http://www.sohu.com/a/772072510_639898,"原标题：深圳水贝上演“黄金大劫案”？涉及资金2亿元？记者实探！商家回应
网传深圳水贝有商家携上百斤黄金贷款“跑路”？
4月16日，有网络消息称深圳水贝有商家携上百斤黄金货款“跑路”，网传涉及400公斤黄金原料，金额或高达两亿元。
商家回应：谣言
证券时报记者随即前往网传涉事的千百万珠宝，公司门店位于深圳水贝二路。记者在现场看到，门店仍正常开门，但店内工作人员对网络消息不作回应。而在路边，时不时会有一些人围着门店看。随后，记者以客户身份联系到一位工作人员，该工作人员在电话中连续多次重申网络上的消息是谣言，商铺仍在经营中。
吴家明/摄
记者还采访了千百万珠宝附近的商户，有商户表示：“即便事情是真的，也不太可能两亿元那么多，人家把金料放在他那里，然后没结出去款，一般就这样。”
记者也致电深圳罗湖翠竹派出所，但截至发稿未获回复。记者也将对此事进行追踪。
水贝倡导黄金交易实名制
近年来，珠宝行业的借货、代卖、寄售行为多次导致纠纷。此前，有市场消息指出，有个别水贝原料商习惯于用低于场内(上海黄金交易所属于场内)的价格吸引柜台商家，背后往往存在对赌行为，近期金价快速走高，容易导致对赌失败。作为黄金原料买卖中间商，“爆雷”或是因为在上游拿黄金原料赊账，然后收下游商家货款，但是一直未发货。
随着金价上涨，有关黄金话题持续受到关注。此前，有消息称，深圳罗湖翠竹派出所发出告知书：鉴于近期发生多起电信网络诈骗团伙使用涉诈资金在黄金店铺交易的行为，为避免造成广大商户银行账户无法正常使用甚至经济损失，提出多项防范交易风险的注意事项，其中包括黄金交易应严格落实实名登记制度，对于当日交易总额在两万元以上的买卖黄金等贵金属人员应实名登记，需核实并确保购买人使用的银行卡户名和本人身份证一致。
有业内律师告诉记者，由于黄金的高价值、易于匿名交易和便捷流通的特性，成为了犯罪分子进行洗钱的首选。犯罪分子采取购买黄金的方式来规避监管，以此来切断资金的追踪线索。黄金的匿名性和可随时转让的特性，让他们可以在未来随时将其兑换成现金。
深圳罗湖翠竹派出所工作人员在接受证券时报记者采访时表示，相关部门确实有发布倡导商家对黄金购买者进行实名登记的公告，但并非强制性规定。
近段时间以来，国际金价屡创新高带动国内足金价格接连跳涨。记者实探发现随着金价不断走高，当前消费者已逐步转向观望。有商家表示，近期在黄金价格飙涨后，想在水贝市场购买金饰的人少了一些，水贝市场内的客流也稍微变少了一些。
更有黄金加工企业负责人表示，由于黄金价格走高，下游黄金销售商家拿货也变得谨慎，一些黄金加工企业的订单出现下滑，下游商家补充黄金原料的意愿不足，这让黄金加工企业的原料周转也慢了起来。
责编：朱雨蒙
校对：廖胜超
版权声明
证券时报各平台所有原创内容，未经书面授权，任何单位及个人不得转载。我社保留追究相关行为主体法律责任的权利。返回搜狐，查看更多
责任编辑："
第135届广交会今日开幕！横沥10家企业组团亮相,2024-04-16 15:19,http://www.sohu.com/a/772071196_121491211,"原标题：第135届广交会今日开幕！横沥10家企业组团亮相
4月15日，第135届中国进出口商品交易会（简称“广交会”）开幕。各地企业云集广州参加线下展览。其中，东莞市横沥镇有10家企业“亮相”本届广交会，全力以赴抢订单、拓市场，提高企业竞争力和知名度，助力横沥外贸经济更上新台阶。
广交会是帮助企业拓展海外市场的重要渠道，被誉为“中国第一展”，参展企业为外贸企业，且多为终端产品生产企业，是我市外贸企业抢接订单、开拓国际市场的重要平台。本届广交会全市共有378家企业参展，共计882个展位。
横沥镇高度重视本届广交会参展工作，深入了解企业的诉求，积极当好参展企业的“贴心人”，协助企业以最佳的产品形象亮相展会，助力企业更好地“走出去”，扩大横沥经贸合作圈，进一步拓展国内外市场，助力企业高质量发展。
横沥共有10家企业分三期参加本届广交会，第一期参展的企业分别是东莞市港田高分子材料有限公司、东莞市简智电子有限公司、广东天倬智能家居有限公司、东莞成乐电子有限公司、东莞颖承兴科技有限公司、东莞千石家电有限公司、东莞巨扬电器有限公司，参展时间为4月15—19日；第二期参展企业为东莞市英尚硅胶制品有限公司，参展时间为4月23—27日；第三期参展企业为东莞市杰森运动器材有限公司、东莞市伟登皮具有限公司，参展时间为5月1—5日。参展企业主要涵盖液体硅胶、家用电器、照明产品、硅胶厨具、皮具箱包及运动器材等方面。
多年来，横沥镇积极通过参展补贴政策推动企业参展参会，帮助企业开拓国内外市场。2023年累计组织或推动253家次企业参加义乌智能装备展、中国国际模具展、立嘉智能装备展、海博会、加博会等境内展；帮助141家次企业参加香港电子展等境外展，帮助企业拓展市场。横沥镇经发局相关负责人表示，将继续做好广交会宣传及服务工作，全力促进横沥外贸高质量发展，助力横沥外贸经济更上新台阶。
来源：文明横沥
返回搜狐，查看更多
责任编辑："
步步高136个银行账户已解冻，有门店被胖东来“爆改”后客流涨5倍,2024-04-16 15:14,http://www.sohu.com/a/772070567_116237,"原标题：步步高136个银行账户已解冻，有门店被胖东来“爆改”后客流涨5倍
红星资本局4月16日消息，近日陷入破产困境的步步高（*ST步高）有了新气象。一边是重整有了新进展：银行账户被解冻、确定了第一批中选产业投资人，另一边是胖东来爆改促使其门店日销、客流翻5倍。
据步步高4月15日发布的公告，因重整受理，截至4月12日，相关法院已删除涉及步步高股份的全部失信被执行人信息，并解除对136个银行账户的冻结措施。
同时，步步高还将有新资本注入。
据公告，步步高确定成都白兔有你文化传播有限公司（吉富白兔联合体成员，以下简称“白兔有你”）、中国对外经济贸易信托有限公司（联合其产业合作伙伴中化现代农业有限公司，以下简称“外贸信托”）为中选产业投资人。
据了解，白兔有你是一家短视频MCN机构，孵化了“骆王宇”“特别乌啦啦”“张喜喜”等带货KOL（关键意见领袖）。步步高表示，白兔集团专注于美妆、时尚，美食等快消品牌的赋能与孵化，以“红人经济 + 品牌赋能” 为核心，将依托线上零售能力优势、供应链整合能力优势和品牌营销优势，对步步高股份进行产业赋能。
据步步高，外贸信托的产业合作伙伴中化现代农业有限公司是种业龙头企业先正达集团股份有限公司的全资子公司，中化现代农业有限公司将对步步高股份进行产业赋能，优化生鲜与农立品领域供应链品质，降低采购成本，进一步拓宽公司资源和发展优势。
红星资本局注意到，近日，步步高还迎来了以胖东来为代表的30多家商超企业帮扶。据微信公众号“步步高时间”，3月31日，于东来率团队赴长沙并做出重大决定：启动帮扶步步高。同时，步步高官微介绍，作为胖东来帮扶首店，步步高梅溪新天地店将从员工薪酬、卖场布局、商品重整、价格优化等方面进行系统调整。
多家媒体报道称，步步高被调改后的4月14日一门店销售突破100万元，客流达到13000人。调改前，该门店平均日销在15万元左右，日均客流2000人。这也意味着，调改后该门店销售、客流均翻了5倍多。
图自微信公众号“步步高时间”
红星新闻记者 张露曦 俞瑶
编辑 杨程返回搜狐，查看更多
责任编辑："
【地评线】河声丨互利天下谋合作 开放之约不止步,2024-04-16 15:04,http://www.sohu.com/a/772067459_121620820,"原标题：【地评线】河声丨互利天下谋合作 开放之约不止步
潮起珠江，万商云集，一年一度的广交会如约而至。4月15日，以“服务高质量发展、推进高水平开放”为主题的第135届广交会在广州拉开大幕，开幕首日，境外采购商到会踊跃。截至4月15日17时，境外采购商线下到会已超6万人、来自全球205个国家和地区，到会人数比上届同期增长18.5%。世界各国共赴开放之约，见证了中国开放之门越开越大的态度与决心。
4月15日，第135届中国进出口商品交易会在广州开幕。新华社图
本届广交会预计现场展出的新品将超过100万件，绿色产品将超过45万件，自主知识产权产品将超过25万件，均较上届有所增长。目前，境外采购商预注册人数较上届大幅增加，其中，共建“一带一路”国家采购商注册数量增加45.9%。事实证明，世界需要中国，中国离不开世界，如期而至的广交会，已走过68载，万商云集见证了中国对外开放之门越开越大，中国与世界共享发展机遇的决心越来越坚定。广交世界、互利天下，广交会吸引着世界的目光，也必然推动中国与世界在发展中凝聚更多共识，为世界经济发展注入更多活力。
广交会是中国对外开放的平台，也是中国外贸的“风向标”与“晴雨表”。今年一季度，我国进出口规模历史同期首次突破10万亿元，进出口增速创6个季度以来新高，可见中国外贸始终保持着强劲的活力。本届展会展览面积155万平方米，设55个展区。展位总数约7.4万个，参展企业超2.9万家，其中参加出口展2.86万家、进口展680家。截至4月14日，有215个国家和地区的14.9万名境外采购商预注册，较上届增长17.4%。在参展企业中，国家级高新技术企业、制造业单项冠军企业、专精特新“小巨人”企业超过5500家，比上届增长20%。世界青睐中国，透过越办越好的广交会，能够清楚地看到国外企业对中国市场投出的信任票，也再次证明中国好、世界会更好。
今年的政府工作报告提出，积极扩大优质产品进口。长期以来，我国坚持实施扩大进口战略，进口保持向好态势。一个开放的中国，始终与世界分享发展的红利，也让我们看到中国与世界的紧密联系。从进博会到广交会，从服贸会到消博会，世界各国主动奔赴“东方之约”的背后，彰显出世界与中国的合作更加紧密。作为世界第二大经济体，持续改革开放和技术创新的中国，将为不确定性的世界经济增加“确定性”。互惠互利、扩大开放，中国与世界的携手合作，必然助力中国与各国一同走向更加繁荣发展的未来。
互利天下谋合作，开放之约不止步。中国开放之门越开越大，中国与世界相向而行，积极分享中国市场，为世界经济发展注入了一份中国力量，也必然为全人类的美好明天提供有力支撑。（大河网河声评论员 李小丽）
编辑： 返回搜狐，查看更多
责任编辑："
赵薇！突发！又有股权冻结,2024-04-16 15:04,http://www.sohu.com/a/772069230_120852719,"原标题：赵薇！突发！又有股权冻结
赵薇名下又有股权遭到冻结。
16日，据中国基金报援引天眼查信息显示，4月11日，赵薇名下部分所持股权被冻结，冻结股权标的企业为合宝文娱集团有限公司，被冻结股权金额为500万元人民币。
事实上，早在2021年4月，赵薇名下多个所持股权就陆续被冻结，冻结股权标的企业涉及芜湖东润发投资有限责任公司等，合计金额超过千万元，冻结期限至2024年4月末。
最近几年，赵薇的商业版图不断缩水。早年巅峰时期，赵薇入股的公司多达17家，涉及影视、文娱、投资、科技、房地产等。据天眼查显示，赵薇担任法人的公司中，仅赵赵（上海）影视文化工作室仍处于存续期，另外两家均已注销或吊销。
早在2018年，赵薇还曾接到证监会罚单。当年4月11日，证监会发布了《行政处罚决定书》及《市场禁入决定书》，对万家文化、龙薇传媒责令改正，给予警告，并分别处以60万元罚款；对孔德永、黄有龙、赵薇、赵政给予警告，并分别处以30万元罚款，对黄有龙、赵薇、孔德永分别采取5年证券市场禁入措施。（来源：北京商报、中国基金报、天眼查）返回搜狐，查看更多
责任编辑："
增幅明显！第135届广交会超3万名非洲客商登记参会,2024-04-16 15:03,http://www.sohu.com/a/772067061_362042,"原标题：增幅明显！第135届广交会超3万名非洲客商登记参会
4月16日，在第135届广交会国际市场开拓分享会上，广交会副秘书长、中国对外贸易中心副主任周善青表示，作为国际经贸盛会，广交会是中非贸易的桥梁，本届预登记参会的非洲采购商超3万名，较往届增幅明显。
据悉，近五届广交会线下展平均每届有1.4万名非洲采购商到会，线上展平均有9.5万名非洲采购商参加。与此同时，广交会累计吸引来自埃及、乌干达、肯尼亚、赞比亚等46个非洲国家的企业参与广交会进口展，产品涵盖电子家电、五金及建材、家居用品、食品等题材。
作为对外开放的平台，广交会是中非合作的纽带。众多中国企业从广交会出发，在车辆、家电、机械、能源等贸易领域发挥领头羊作用，在优化自身市场布局的同时，稳步扩大对非投资，加强合作建厂，创造就业机会，推动当地产业链升级，积极促进非洲经济增长，为中国与非洲贸易合作做出了积极贡献。
去年，中非贸易额达到2821亿美元的历史峰值，中国已连续15年成为非洲第一大贸易伙伴。
（总台记者 陈惠婷）返回搜狐，查看更多
责任编辑："
一季度经济增速5.3%，有哪些亮点？就业、物价、房地产表现如何？,2024-04-16 15:02,http://www.sohu.com/a/772066955_120388781,"原标题：一季度经济增速5.3%，有哪些亮点？就业、物价、房地产表现如何？
我国一季度经济“成绩单”已正式公布，国家统计局副局长盛来运用四个关键词评价一季度经济运行情况：持续回升、起步平稳、稳中有进、开局良好。
一季度5.3%的经济增速背后有哪些亮点？如何解读？国是直通车带你一文速览。
失业率下降，收入“跑赢”GDP
一季度，全国城镇调查失业率平均值为5.2%，比上年同期下降0.3个百分点。3月份，全国城镇调查失业率为5.2%，比上月和上年同月均下降0.1个百分点。
一季度，全国居民人均可支配收入11539元，同比名义增长6.2%，扣除价格因素实际增长6.2%。按常住地分，城镇居民人均可支配收入15150元，同比名义增长5.3%，实际增长5.3%；农村居民人均可支配收入6596元，同比名义增长7.6%，实际增长7.7%。
盛来运当天发布会后回答媒体提问时表示，自己对中国就业市场比较乐观，当前中国总量就业没有问题，失业率在下降。同时，中国经济仍在增长，蛋糕还在做大；产业在升级，服务业发展加快等，都将带来更多就业岗位。
浙江大学国家制度研究院副院长金维刚16日在中新社主办的“国是论坛：2024年一季度经济形势分析会”上表示，从今年一季度总体情况来看，就业市场开局良好，企业开工复产、农民工返岗流动方面保持基本平稳。企业招聘、劳动力求职依然保持比较活跃的态势，特别是在人工智能、大数据等领域，人才需求比较旺盛。
浙江大学国家制度研究院副院长金维刚 国是直通车 赵斌 摄
同时，康养护理、住宿、餐饮、文化旅游等服务业的需求不断增长。从企业情况来看，小微企业招聘需求明显增加，技术技能岗位的需求也是快速增长。金维刚认为，目前就业领域情况从侧面反映出，中国经济逐步企稳回升向好的态势进一步得到了巩固。
价格有望温和回升，部分农产品价格到拐点
一季度，全国居民消费价格（CPI）同比持平，扣除食品和能源价格后的核心CPI同比上涨0.7%。3月份，全国居民消费价格同比上涨0.1%，环比下降1.0%。
一季度，全国工业生产者出厂价格同比下降2.7%。其中，3月份同比下降2.8%，环比下降0.1%。
盛来运说，从未来走势看，CPI会在低位缓慢回升。一方面是经济持续向好，总需求在回升，这对支撑CPI回升是一个很重要的基本面因素。
另一方面，部分农产品价格也到了价格调整拐点，比如生猪价格。此外接下来的假日消费，包括五一节等还会继续带动旅游相关出行类消费价格回暖。“还有一些推动需求回暖的因素，都会对物价回升带来一定影响。总的判断是，价格有望在低位温和回升。”
消费潜力加速释放，服务消费增长快
一季度，社会消费品零售总额120327亿元，同比增长4.7%。全国网上零售额33082亿元，同比增长12.4%。3月份，社会消费品零售总额同比增长3.1%，环比增长0.26%。一季度，服务零售额同比增长10.0%。
数据还显示，一季度，服务业增加值同比增长5.0%。其中，信息传输、软件和信息技术服务业，租赁和商务服务业，交通运输、仓储和邮政业，住宿和餐饮业，批发和零售业增加值分别增长13.7%、10.8%、7.3%、7.3%、6.0%。
中国宏观经济研究院经济研究所副所长郭丽岩在中新社举办的“国是论坛：2024年一季度经济形势分析会”上表示，从一季度数据来看，当前在进一步巩固内需对经济增长拉动作用的同时，外需的支撑力也在增强。
中国宏观经济研究院经济研究所副所长郭丽岩 国是直通车 赵斌 摄
她提到，随着人均收入水平提升，整个消费需求结构升级，服务消费占整个消费支出的比重还会稳步增长。当前消费的潜力在加速释放，但也有一些结构性的压力和问题需要再加力解决，比如居住类消费还有很大的潜力，有待通过消费品以旧换新、通过畅通市场循环的堵点卡点进一步释放活力。
固定资产投资提升，房地产市场还在调整
一季度，全国固定资产投资（不含农户）100042亿元，同比增长4.5%，比上年全年加快1.5个百分点；扣除房地产开发投资，全国固定资产投资增长9.3%。其中，房地产开发投资下降9.5%。全国新建商品房销售面积22668万平方米，同比下降19.4%；新建商品房销售额21355亿元，下降27.6%。
此外，高技术产业投资增长较快。高技术产业投资同比增长11.4%，其中高技术制造业和高技术服务业投资分别增长10.8%、12.7%。
盛来运表示，目前中国房地产市场仍处于调整过程中。今年一季度，房地产一些销售指标降幅扩大，有去年同期对比基数较高的原因，去年3月份是房地产销售的“小阳春”。
他认为，中国现有存量房中，90平米以下的房子占绝大多数，随着人们生活水平的提高和城镇化推进，改善型和刚性需求依然较大，中国仍有支撑房地产健康发展的条件。
工业表现亮眼，高技术制造业增速快
一季度，全国规模以上工业增加值同比增长6.1%。分三大门类看，采矿业增加值增长1.6%，制造业增长6.7%，电力、热力、燃气及水生产和供应业增长6.9%。高技术制造业增加值增长7.5%，比上年四季度加快2.6个百分点。
盛来运表示，工业确实是一季度恢复发展中的一个亮点，全部工业增加值增长6%，这也是近几年季度中表现比较好的数字，比去年一季度提高了3.1个百分点，比去年四季度加快0.8个百分点，显示了工业经济回升向好的态势。
从趋势看，光大银行金融市场部宏观研究员周茂华认为，工业产出有保持稳健扩张，结构持续优化。主要是国内工业市场需求复苏，尤其高技术装备制造业需求稳健扩张，工业部门库存与盈利持续改善，推动工业部门发展信心稳步恢复。
他认为，中国有望逐步进入主动补库存周期，工业产出稳步扩张。国内设备更新改造与消费品以旧换新及工业部门积极应对国际市场需求变化，工业发展量和质有望稳步提升。
进出口增长稳定，结构持续优化
一季度，货物进出口总额101693亿元，同比增长5.0%。其中，出口57378亿元，增长4.9%；进口44315亿元，增长5.0%。进出口相抵，贸易顺差13063亿元。
中国社科院财经战略研究院国际经贸研究室主任张宇在“国是论坛：2024年一季度经济形势分析会”表示，中国进出口贸易一季度有所回暖，进出口结构升级的态势在进一步保持。
中国社科院财经战略研究院国际经贸研究室主任张宇 国是直通车 赵斌 摄
例如，一季度出口的机电类产品，特别一些船舶类产品出口增长非常快。从去年开始，“新三样”就在支撑中国出口中发挥了重要作用，今年机电类产品仍在出口产品当中扮演了重要角色。一季度劳动密集型产品出口也有较为显著的增长。这表明劳动密集型产品生产的流程、工艺随着技术进步在发生调整。
张宇还表示，中国外贸在继续开拓新兴市场，民营企业在对外贸易发展过程中的作用越来越突出，贸易新业态已逐渐成为中国贸易新支撑。
原标题：一季度经济增速5.3%，有哪些亮点？就业、物价、房地产表现如何？
编辑：陈璐  责编：周尚斗  审核：冯飞
【免责声明】上游新闻客户端未标有“来源：上游新闻”或“上游新闻LOGO、水印的文字、图片、音频、视频”等稿件均为转载稿。如转载稿涉及版权等问题，请 联系上游。
举报 返回搜狐，查看更多
责任编辑："
